{
  "$schema": "./installer.settings.schema.json",
  "ProductName": "BlinkObserverTool",
  "Manufacturer": "pokenae",
  "Version": "git",
  "UpgradeCode": "DE3231A1-62C5-4F03-B676-3F8ACCCCE08A",
  "LegacyUpgradeCode": "813D1E2D-7D7A-4984-A062-81B06B5EBC26",
  "AppDirectoryName": "BlinkObserverTool",
  "CommonCompanyDirName": "pokenae",
  "CommonAppsRootDirName": "BlinkTools",
  "MainExecutableName": "BlinkObserverTool.exe",
  "IconFilePath": "",
  "AppSourceDir": ".\\obj\\publish",
  "ReferencedAppProjectPath": "..\\..\\BlinkObserverTool\\BlinkObserverTool.csproj",
  "PublishRuntimeIdentifier": "win-x64",
  "PublishSelfContained": true
}
